{
  "$schema": "https://json-schema.org/draft/2020-12/schema",
  "$id": "https://mindrail.dev/schemas/knowledge/decision.v1.schema.json",
  "title": "Mindrail Decision record, schema version 1",
  "description": "A Decision answers \"why did we choose this path?\" (spec §53). Records are immutable: a newer Decision supersedes an older one instead of overwriting it.",
  "type": "object",
  "required": [
    "schema_version",
    "kind",
    "id",
    "status",
    "created_at",
    "title",
    "decision"
  ],
  "additionalProperties": false,
  "properties": {
    "schema_version": {
      "description": "Reader compatibility window key (spec §95). 0.1 writes 1 and reads [1].",
      "type": "integer",
      "const": 1
    },
    "kind": {
      "type": "string",
      "const": "decision"
    },
    "id": {
      "description": "Stable repository-unique identity; the file name must agree with it.",
      "type": "string",
      "pattern": "^DEC-[0-9]{4,}$"
    },
    "status": {
      "description": "A superseded Decision stays in the repository so lineage survives (spec §93).",
      "type": "string",
      "enum": ["active", "superseded"]
    },
    "created_at": {
      "description": "UTC RFC 3339 timestamp (tech-stack §42). Write it with an uppercase \"T\", a zero offset spelled \"Z\", \"+00:00\" or \"-00:00\", and at most nine fractional-second digits: the spelling Go's time.Time marshals, and the only one this project writes. The two keywords divide one rule and do not restate each other: \"format\" owns calendar validity, which a regular expression cannot decide (it knows how long February is); \"pattern\" owns the spelling, which \"format\" is deliberately permissive about. RFC 3339 is wider than §42, and on two different grounds. A lowercase \"t\" or \"z\" (RFC 3339 §5.6) and a leap second (§5.7) are refused because no reader in this project can load them at all. A non-zero offset such as \"-05:00\" is refused on the spelling rule alone: every reader loads it, and the offset names exactly the instant it says. More than nine fractional digits is refused on that same spelling rule, and loses precision whenever the extra digits are not zero. See decision D-49.",
      "type": "string",
      "format": "date-time",
      "pattern": "^[0-9]{4}-[0-9]{2}-[0-9]{2}T[0-9]{2}:[0-9]{2}:[0-5][0-9](\\.[0-9]{1,9})?(Z|[+-]00:00)$"
    },
    "title": {
      "type": "string",
      "minLength": 1
    },
    "context": {
      "description": "The situation that forced a choice.",
      "type": "string"
    },
    "decision": {
      "description": "The choice itself, stated in one or more sentences.",
      "type": "string",
      "minLength": 1
    },
    "consequences": {
      "description": "What the choice costs or forecloses.",
      "type": "string"
    },
    "supersedes": {
      "description": "Identities of the Decisions this record replaces (spec §93).",
      "type": "array",
      "items": {
        "type": "string",
        "pattern": "^DEC-[0-9]{4,}$"
      },
      "uniqueItems": true
    },
    "scope": {
      "$ref": "#/$defs/scope"
    },
    "tags": {
      "type": "array",
      "items": {
        "type": "string",
        "minLength": 1
      },
      "uniqueItems": true
    }
  },
  "$defs": {
    "scope": {
      "description": "Where the record applies (spec §54 scope levels).",
      "type": "object",
      "required": ["level"],
      "additionalProperties": false,
      "properties": {
        "level": {
          "type": "string",
          "enum": ["PROJECT", "PACKAGE", "MODULE", "FILE", "SYMBOL"]
        },
        "target": {
          "description": "Repository-relative, forward-slash path or symbol reference (tech-stack §74). Absent for PROJECT scope.",
          "type": "string",
          "minLength": 1
        }
      }
    }
  }
}
